{
  "$schema": "http://json-schema.org/draft-04/schema#",
  "additionalProperties": false,
  "definitions": {
    "CloudFormationResource": {
      "additionalProperties": true,
      "properties": {
        "Type": {
          "pattern": "^(?!^AWS::Serverless).*",
          "type": "string"
        }
      },
      "required": [
        "Type"
      ],
      "type": "object"
    },
    "Tag": {
      "additionalProperties": false,
      "properties": {
        "Key": {
          "type": "string"
        },
        "Value": {
          "anyOf": [
            {
              "type": "string"
            },
            {
              "type": "object"
            }
          ]
        }
      },
      "type": "object"
    }
  },
  "properties": {
    "AWSTemplateFormatVersion": {
      "enum": [
        "2010-09-09"
      ],
      "type": "string"
    },
    "Conditions": {
      "additionalProperties": false,
      "patternProperties": {
        "^[a-zA-Z0-9]+$": {
          "type": "object"
        }
      },
      "type": "object"
    },
    "Description": {
      "description": "Template description",
      "maxLength": 1024,
      "type": "string"
    },
    "Mappings": {
      "additionalProperties": false,
      "patternProperties": {
        "^[a-zA-Z0-9]+$": {
          "type": "object"
        }
      },
      "type": "object"
    },
    "Metadata": {
      "type": "object"
    },
    "Outputs": {
      "additionalProperties": false,
      "maxProperties": 60,
      "minProperties": 1,
      "patternProperties": {
        "^[a-zA-Z0-9]+$": {
          "type": "object"
        }
      },
      "type": "object"
    },
    "Parameters": {
      "type": "object"
    },
    "Resources": {
      "type": "object"
    },
    "Transform": {
      "enum": [
        "AWS::Serverless-2016-10-31"
      ],
      "type": "string"
    },
    "Globals": {
      "type": "object"
    },
    "Properties": {
      "type": "object"
    }
  },
  "required": [
    "Resources"
  ],
  "type": "object"
}
